titulo,fecha,articulo,url,lugar,fecha_limpia
Descarta PC “mar de fondo” en costas de Veracruz,"Xalapa, Ver.   18/04/2025","El fenómeno de “mar de fondo”, caracterizado por un aumento en el oleaje, no se presentaría en el estado Veracruz, previó el analista de la Subdirección de Estudios y Pronóstico Meteorológico de la Secretaría de Protección Civil, Raymundo Contreras. Estimó que cuanto mucho, las olas puedan alcanzar de un metro a un metro y medio en la costa central debido a la intensidad del viento en dicho litoral. Con lo anterior descartó dicha posibilidad luego que en aguas de Guerrero, turistas y residentes grabaron momentos del denominado “mar de fondo” con olas de entre los 3 a los 4 metros en playas de Acapulco. “Las velocidades del viento van a ser moderadas, de 25 a 30 kilómetros por hora, no va a cambiar mucho en cuanto la marea, vamos a tener las brisas normales, en la costa”. El especialista consideró que por lo anterior continuaría el tiempo estable en la costa veracruzana, sin que se presente dicho riesgo asociado al viento. “En un análisis más extendido no tendríamos la llegada de frentes fríos que puedan ocasionar algún cambio drástico a la entidad veracruzana”.",https://www.alcalorpolitico.com/informacion/descarta-pc-mar-de-fondo-en-costas-de-veracruz-423763.html,"Xalapa, Ver.  ",18/04/2025
"Cientos acudieron al Viacrucis de Catedral de la Inmaculada Concepción, en Córdoba","Córdoba, Ver. 18/04/2025","Cientos de feligreses participaron en el viacrucis de la Catedral de la Inmaculada Concepción. Las 14 estaciones fueron situadas en el Centro Histórico de la ciudad y concluyeron nuevamente en la Catedral. El sacerdote Domingo Ortiz Medina fue quien encabezó el recorrido. En cada estación se realiza una oración: por los enfermos, por los presos, por la paz y la seguridad. A las 13:00 horas se dio lectura de las siete palabras; a las 15:00 horas fue el descendimiento del cuerpo de Jesús. La sirena de Palacio sonó en señal de luto. Hoy es el día mayor, día en el cual los feligreses recuerdan la Pasión y muerte de Jesucristo. Por la noche se realizará la procesión del silencio; acompañarán a la Virgen de la Soledad en su dolor.",https://www.alcalorpolitico.com/informacion/cientos-acudieron-al-viacrucis-de-catedral-de-la-inmaculada-concepcion-en-cordoba-423766.html,"Córdoba, Ver",18/04/2025
"Gran participación en Procesión del Silencio este Viernes Santo, en Orizaba","Orizaba, Ver. 18/04/2025","Aunque la Procesión del Silencio, es primordialmente para que participen los varones, esta noche en Orizaba, personas de todas las edades y familias completas decidieron salir en esta expresión de fe, encabezados por el obispo Eduardo Cervantes Merino. Esta salió de la iglesia Santa Gertrudis, ubicada en el Oriente de la ciudad. Quien inició el contingente fue la Marching Band de la Catedral San Miguel Arcángel, sus integrantes comenzaron tocando la melodía del canto ""Perdón ¡oh Dios mío!, para después sólo llevar un toque que significaba luto. Seguido iban los monaguillos, sacerdotes y el obispo, tras ellos la imagen de Cristo y finalmente el contingente de los fieles. En esta denominada la ""Procesión del silencio de la Esperanza"", no sólo participaron varones, pues principalmente ellos son los llamados a ser parte de esta expresión de fe, sino que también acudieron personas de todas las edades y familias enteras que portaban una vela blanca. Su destino fue la catedral de Orizaba, aunque previo a esta actividad un grupo de mujeres salieron del parque de la Alameda Central, para llegar al mismo destino, pero llevando la imagen de La Dolorosa.",https://www.alcalorpolitico.com/informacion/gran-participacion-en-procesion-del-silencio-este-viernes-santo-en-orizaba-423779.html,"Orizaba, Ver",18/04/2025
Respuesta a Sor Filotea de la Cruz-Sor Juana Inés de la Cruz,18/04/2025,"Un predicadorjesuita portugués, Antonio Vieiria, se había hecho famoso por su oratoria y sus sermones. Gerardo Morales H. De la Cruz, Juana Inés: “Respuesta a Sor Filotea de la Cruz”; Décima reimpresión, Distribución Fontamara, S. A., México, 2004, pp 88.",https://www.alcalorpolitico.com/informacion/respuesta-a-sor-filotea-de-la-cruz-sor-juana-ines-de-la-cruz--423771.html,,18/04/2025
"Joven xalapeño murió al volcar su vehículo tipo Razer, en Alvarado","Alvarado, Ver. 18/04/2025","La noche de este jueves se reportó el deceso de un hombre joven, de nombre Emiliano, tras volcar un vehículo tipo Razer en una playa privada de la Riviera Veracruzana, perteneciente al municipio de Alvarado. El lamentable accidente sucedió en el fraccionamiento El Ensueño. Datos extraoficiales apuntan que el joven, proveniente de la ciudad de Xalapa, se encontraba disfrutando de sus vacaciones y habría sido el exceso de velocidad lo que provocó que volcara y, por el impacto, perdiera la vida. Elementos policiales realizaron las labores correspondientes hasta el arribo de personal de la Fiscalía y peritos, quienes efectuaron el levantamiento del cuerpo. Preliminarmente se supo que la víctima tenía cerca de 20 años y respondía al nombre de Emiliano.",https://www.alcalorpolitico.com/informacion/joven-xalapenio-murio-al-volcar-su-vehiculo-tipo-razer-en-alvarado-423767.html,"Alvarado, Ver",18/04/2025
Orizabeños también participaron en Viacrucis,"Orizaba, Ver.  18/04/2025","Este Viernes Santo, encabezados por el obispo de Orizaba, Eduardo Cervantes Merino, los fieles católicos participaron en el “Viacrucis de la Esperanza”. En las diferentes estaciones se oró por los migrantes, los enfermos de cáncer, especialmente por los jóvenes, los desaparecidos y por quienes sufren dolor a consecuencia de la violencia. El prelado, acompañado por algunos otros sacerdotes, realizó el recorrido por diversas calles de Orizaba, aunque en esta ocasión la ruta fue distinta, debido a que las calles del municipio están en rehabilitación, lo que complica el tránsito. En cada una de las estaciones se pidió por distintos problemas sociales, como los desaparecidos, los migrantes y los pacientes oncológicos, quienes también enfrentan la escasez de medicamentos en algunos hospitales. De igual forma, se rogó por la juventud, para que no se pierda ni caiga en manos de quienes infringen la Ley. Asimismo, se oró por las personas que sufren violencia en cualquiera de sus expresiones. El trayecto concluyó en la Catedral de San Miguel Arcángel, donde se llevó a cabo la misa de las Siete Palabras, presidida por el prelado, quien hizo un llamado a la conversión del corazón.",https://www.alcalorpolitico.com/informacion/orizabenios-tambien-participaron-en-viacrucis-423758.html,"Orizaba, Ver. ",18/04/2025
"Incendio en bodega en la colonia Rafael Lucio, moviliza a Bomberos de Xalapa","Xalapa, Ver. 18/04/2025","Se incendia una bodega en la colonia Rafael Lucio, la noche de este viernes, Bomberos llegaron a sofocar el fuego. Transeúnte alertaron al 911 que se estaba incendiando una bodega ubicada en la calle Ismael Cristein, esquina con Lázaro Cárdenas, en la colonia Rafael Lucio. Bomberos de la estación Norte y agrupaciones de emergencia de inmediato se trasladaron al lugar del siniestro. Al llegar los Bomberos comenzaron atacar el fuego arrojando agua con sus mangueras. Tras varios minutos de labores Los Bomberos lograron controlar el incendio. No se reportan lesionados, sólo daños materiales, informaron elementos de Protección Civil.",https://www.alcalorpolitico.com/informacion/incendio-en-bodega-en-la-colonia-rafael-lucio-moviliza-a-bomberos-de-xalapa-423777.html,"Xalapa, Ver",18/04/2025
Quejas de Héctor Yunes contra Presidenta del Congreso se quedaron “en lo mediático”,"Xalapa, Ver. 18/04/2025","Hasta la fecha, la diputada Tanya Carola Viveros Cházaro, presidenta de la Mesa Directiva del Congreso del Estado, no ha recibido notificación sobre la denuncia que el legislador priista Héctor Yunes Landa presentó en su contra ante la Fiscalía General de la República (FGR) por presuntos ultrajes a los símbolos patrios. “Hasta ahora no me han requerido, ha quedado en lo mediático”, declaró la diputada, quien atribuyó la acción del Legislador del PRI a una estrategia política. “Ha estado encima con el golpeteo, sin muchos argumentos realmente, pero pues ese es el papel que él ha decidido”, dijo la morenista. En entrevista, Viveros Cházaro cuestionó el uso de temas delicados por parte de Yunes Landa, como el de la seguridad y los candidatos que se han retirado del proceso electoral. “Me parece lamentable porque queda muy a la vista el uso que está haciendo sin ningún tacto con las víctimas”, sostuvo. Sobre la denuncia interpuesta, Yunes Landa acusó que Viveros Cházaro viola el artículo 45 de la Ley sobre el escudo, la bandera y el Himno nacionales, así como el artículo 192 del Código Penal Federal, al levantar el puño durante la entonación del Himno Nacional en las sesiones del Pleno. El Legislador priista adelantó que si la FGR no da curso a su denuncia acudirá ante un Juez de Control. “Si este caso lo quieren esconder o dicen que no procede, podemos ir ante un Juez para pedir que revise la resolución”, declaró.",https://www.alcalorpolitico.com/informacion/quejas-de-hector-yunes-contra-presidenta-del-congreso-se-quedaron-en-lo-mediatico--423759.html,"Xalapa, Ver",18/04/2025
"Los Lagos de Xalapa, sucios y con hedor a agua estancada","Xalapa, Ver. 18/04/2025","Un hedor a agua estancada y suciedad recibe a los visitantes en el Paseo de Los Lagos, a la altura de la colonia La Isleta, en Xalapa. Vecinos reportaron además la concentración de materia orgánica, lodo y vegetación muerta en el tercer lago, en las inmediaciones de la zona universitaria. En dicho cuerpo de agua, la basura y la materia en descomposición salen a flote y se mezclan con la flora y fauna que habitan en el lugar. De manera anónima, los vecinos acusaron la falta de interés por parte de las autoridades de Xalapa para brindar mantenimiento al lago. Cabe recordar que no es la primera vez que se presenta contaminación en este embalse, ya que a principios de año las descargas de aguas negras infestaron el lago. Este percance provocó la mortandad de peces, que en esa ocasión quedaron flotando a la vista de los asistentes, hecho que fue atribuido a una taquería que derramó sus desechos en este cuerpo lacustre.",https://www.alcalorpolitico.com/informacion/los-lagos-de-xalapa-sucios-y-con-hedor-a-agua-estancada-423754.html,"Xalapa, Ver",18/04/2025
Indagan hallazgo de animales muertos en carretera de Emiliano Zapata,"Xalapa, Ver. 18/04/2025","Al menos 14 animales muertos fueron arrojados en bolsas de plástico en un tramo de la carretera Xalapa-Veracruz, a la altura de Cerro Gordo y Plan del Río, confirmó el presidente municipal, Érick Ruiz Hernández.",https://www.alcalorpolitico.com/informacion/indagan-hallazgo-de-animales-muertos-en-carretera-de-emiliano-zapata-423757.html,"Xalapa, Ver",18/04/2025
Uso mayoritario de automotores quita lugares a bicicleta como alternativa de transporte,"Xalapa, Ver. 18/04/2025","El mayoritario uso de los vehículos a gasolina resta espacios a la movilidad urbana sustentable y la alternativa de la bicicleta como medio de transporte, señalaron los integrantes del Colectivo Sensatos Ciclismo Urbano, Jonathan Rico Márquez y Ana Patricia Díaz Lagunes en entrevista con la Tropa Rosa, por alcalorpolitico.com y TeleClic.tv. Ambos pusieron de ejemplo el proyecto de la Vía Recreativa en Ávila Camacho para el disfrute de las familias sólo los días domingo por la mañana; sin embargo, la queja de los automovilistas se impuso a la iniciativa del Ayuntamiento. “Deben tomar en cuenta que los automovilistas no son dueños de la ciudad, todos somos ciudadanos, somos partícipes de la ciudad. Entonces, sí nos gustaría que se llevara a cabo de nuevo –por el bien de todos y sobre todo de los niños que son los que quieren tener una actividad física– y no hay espacios”, indicó Jonathan. Y es que agregó que la ciudad no cuenta con lugares donde practicar el ciclismo, dado que el Paseo de Los Lagos o Los Berros ya no tienen la accesibilidad de años anteriores. Puntualizó a la vez que se requiere más infraestructura acorde a la movilidad sustentable y por supuesto, aclaró que, aunque se tenga la infraestructura, esta de nada serviría al no haber educación vial tanto de automovilistas, ciclistas y peatones. Los entrevistados admitieron que, si bien muchos xalapeños recurren a la bicicleta como un deporte, varios más aprovechan su utilidad en la movilidad urbana y en el caso de Sensatos, su actividad principal es promover la conciencia del uso responsable de dicho vehículo. “Como ciclista tienes la responsabilidad también de nuestra seguridad: el uso de casco, luces, no puedes salir nada más así, porque te pones en riesgo a ti y puedes poner en riesgo a otras personas, no utilizar banquetas, no ir en sentido contrario, muchas veces no te ven” expresó Ana Patricia. Sensatos realiza rodada los viernes, a partir de las 21:00 horas en el Estadio Xalapeños, además realizan recolecta de tapitas y gestionan la apertura de una biciescuela para enseñar cuestiones de mecánica básica y a andar en las 2 ruedas. Ana Patricia recomendó por todo lo anterior más empatía de los automovilistas en Xalapa para los ciclistas, andar en la ciudad en bicicleta y darse cuenta de la situación de dicho sistema de movilidad. “Y en lugar de gritarnos ‘estás estorbando’, ponte a pensar. Cuídalos. Si puedes escoltar a un ciclista hazlo y así como hay gente que nos ataca (también) hay gente muy buena que te escolta, que te da el paso, que te espera, que no te está pitando”. Por su parte Jonathan admitió que otro problema que enfrentan los ciclistas es el de la seguridad, dado que hay temporadas que ciertas rutas resultan más peligrosas que otras en cuestión de los asaltos. “Lo recomendable es siempre ir con alguien, porque por muy experimentado que seas los accidentes pasan y siempre que vayas con alguien te puede auxiliar y ya si vas solo trata de que te vayan monitoreando dónde andas”. También recomendó buscar en Facebook algún grupo de ciclistas al cual incorporarse, ya que tanto hay grupos de montaña como urbanos con rodadas esporádicas a ciertos lugares de la región. A la entrevista se sumó -desde la Ciclovía de Ruiz Cortines- Wachisneris con los ciclistas Naghtali Contreras y Gastón Rodríguez, quienes explicaron que, en lo personal, más allá de la utilidad, el ciclismo puede representar una experiencia o un espacio para enfrentar diversos retos en la vida. Gastón comentó que en el ciclismo se pueden encontrar varias ramas, técnicas y categorías, empezando por lo urbano, los acrobáticos y los de montaña. Mientras que Naghtali completó que el ciclista debe incluir en su equipo casco, herramientas, luces y si es posible, cámara.",https://www.alcalorpolitico.com/informacion/uso-mayoritario-de-automotores-quita-lugares-a-bicicleta-como-alternativa-de-transporte-423739.html,"Xalapa, Ver",18/04/2025
"Policías lesionados tras chocar patrulla contra autobús, en Alvarado","Alvarado, Ver. 18/04/2025","El choque entre una patrulla de la Secretaría de Seguridad Pública (SSP) y un camión de pasajeros en el municipio de Alvarado, dejó al menos 3 policías lesionados y daños en ambas unidades. El accidente ocurrió sobre la carretera federal Costera del Golfo, en el tramo comprendido entre Alvarado y Paso del Toro, frente al Icatver del municipio de Alvarado. Se trató de la colisión de un autobús de la línea TRV, con número económico 3020 y una patrulla de la Secretaría de Seguridad Pública. Los primeros reportes indican que los elementos policíacos habían acudido a un reporte por esa zona y al incorporarse el chofer de la patrulla a la carretera federal, hizo corte de circulación e impactó al camión de pasajeros. Tras la colisión los elementos policíacos llevaron la peor parte al resultar con algunas lesiones, por lo que fueron atendidos en el mismo lugar, ya que no requerían ser trasladados a algún hospital. Al sitio arribaron agentes de la Guardia Nacional División Carreteras y se hicieron cargo del peritaje correspondiente y el traslado de las unidades al encierro oficial.",https://www.alcalorpolitico.com/informacion/policias-lesionados-tras-chocar-patrulla-contra-autobus-en-alvarado-423772.html,"Alvarado, Ver",18/04/2025
Pescadores de Coatzacoalcos ayudan a cuidar a bañistas,"Coatzacoalcos, Ver. 18/04/2025","Un total de 20 pescadores de Coatzacoalcos vigilan a bordo de sus lanchas la zona de playa para socorrer a tiempo a bañistas que pudieran estar en peligro de ahogarse. Los trabajadores del mar se capacitaron previamente con personal de la Secretaría de Protección Civil (PC), la Secretaría de Seguridad Pública (SSP) y la Secretaría de Marina (SEMAR) sobre primeros auxilios y cómo sacar del mar a los bañistas. “Estamos capacitados, hemos tenido 2 cursos para estar al servicio de la comunidad y estamos preparados para que todos los vacacionistas tengan un buen servicio y así como vienen regresen a sus casas”, afirmó José Luis Carrillo Soto. Ellos esperan de 10:00 a 18:00 horas a bordo de sus lanchas. Aseguran que con esta actividad no sólo apoyan a la comunidad, sino que también llevan un ingreso económico a casa. “Estamos desde las 10 de la mañana hasta las 6 de la tarde, queremos que todo salga bien para todos los que nos visiten. Estamos al pendiente de ellos. Ya tenemos algunos años haciendo este servicio”, finalizó.e",https://www.alcalorpolitico.com/informacion/pescadores-de-coatzacoalcos-ayudan-a-cuidar-a-baniistas-423744.html,"Coatzacoalcos, Ver",18/04/2025
Salvan de morir ahogado a un menor en playa San Ana de Boca del Río,"Veracruz, Ver. 18/04/2025","Está jueves santo, en Boca del Río, elementos de la Policía Turística y GuardaVidas de Protección Civil rescataron del mar a un menor que sufrió un ataque epiléptico mientras nadaba, estuvo a punto de morir ahogado. Fue en la playa Santa Ana de ese municipio, donde los elementos que forman parte del operativo de Semana Santa 2025 que implementó el gobierno del estado con las diferentes fuerzas de tarea, que auxiliaron al joven. Detallaron los presentes que al joven se le brindaron maniobras de RCP, logrando estabilizarlo y canalizarlo al hospital para su atención médica, se reportó su estado de salud delicado. El menor, de aproximadamente 15 años, es vecino del mismo municipio y había acudido con su familia esta temporada de vacaciones para disfrutar del día.",https://www.alcalorpolitico.com/informacion/salvan-de-morir-ahogado-a-un-menor-en-playa-san-ana-de-boca-del-rio-423734.html,"Veracruz, Ver",18/04/2025
Aparatoso choque en Lázaro Cárdenas frente a la Toyota de Plaza Américas en Xalapa,"Xalapa, Ver. 18/04/2025","La noche de este jueves se registró un aparatoso accidente automovilístico en la avenida Lázaro Cárdenas, frente a la agencia automotriz Toyota de Plaza Américas, donde un auto se estrelló contra la base de un anuncio. El accidente sucedió cerca de las 22:00 horas cuando un auto Honda color azul era conducido a exceso de velocidad sobre la avenida Lázaro Cárdenas en el carril que comunica de Tesorería a Las Trancas. Cuando pasaba frente a la agencia automotriz Toyota el conductor del auto perdió el control y se fue sobre su costado derecho chocando contra la base de un anuncio de la mencionada línea vehicular. Al impacto el auto rebotó, quedando a medio carril de la avenida con su parte delantera totalmente destruida siendo pérdida total de la unidad. El conductor y un acompañante afortunadamente resultaron levemente lesionados. El accidente movilizó a Bomberos, Cruz Roja, Protección Civil, EMS, Cruz Ámbar, entre otros grupos de auxilio. El conductor y un acompañante fueron atendidos por los paramédicos de la Cruz Roja, pero se negaron y bajaron de la ambulancia quedando en ese momento el conductor bajo la custodia de personal de Tránsito del Estado.",https://www.alcalorpolitico.com/informacion/aparatoso-choque-en-lazaro-cardenas-frente-a-la-toyota-de-plaza-americas-en-xalapa-423733.html,"Xalapa, Ver",18/04/2025
Recibe Soledad Atzompa la liberación de sus cuentas públicas 2022 y 2023,"Orizaba, Ver. 18/04/2025","El municipio de Soledad Atzompa recibió oficialmente la liberación de sus cuentas públicas correspondientes a los ejercicios fiscales 2022 y 2023, por parte del Órgano de Fiscalización Superior del Estado de Veracruz (ORFIS), al no encontrarse daño patrimonial ni irregularidades administrativas en la revisión técnica y legal. El alcalde Demetrio Cruz de Jesús recibió las cartas de liberación, documento que acredita el cumplimiento estricto de la normatividad en el uso del erario. La notificación fue firmada por la auditora general del ORFIS, Delia González Cobos, y la titular de la Unidad de Investigación, María de Lourdes de la Loza González. Cruz de Jesús expresó que este resultado es un reflejo del compromiso de su administración con la transparencia y el uso responsable de los recursos públicos, como fue su compromiso de campaña de rendier cuentas claras. Subrayó que la rendición de cuentas no es una obligación sólo legal, sino moral frente a los habitantes de las 42 comunidades que integran Soledad Atzompa. “Gobernar con honestidad también significa que el pueblo sepa cómo y en qué se invierte su dinero”, expresó.",https://www.alcalorpolitico.com/informacion/recibe-soledad-atzompa-la-liberacion-de-sus-cuentas-publicas-2022-y-2023-423773.html,"Orizaba, Ver",18/04/2025
Turistas y locales dejan sucias la playa y el malecón de Coatzacoalcos,"Coatzacoalcos, Ver. 18/04/2025","Por la presencia de más visitantes en la zona de playa de Coatzacoalcos, la cantidad de basura dejada en las calles ha aumentado considerablemente. La avenida principal del malecón costero, así como el área de playa, amanece cada día con montones de desechos. Latas, colillas de cigarro, botellas de cristal, cartón y demás residuos se aprecian día con día regados por todos lados. Un grupo de trabajadoras del departamento de Limpia Pública se ha encargado de mantener la playa de Coatzacoalcos libre de residuos al recorrer 5 kilómetros con su rastrillo, araña y bolsas para recoger lo que se genera al día. Estas mujeres son quienes vienen a compensar la falta de civilidad de los visitantes y laboran a marchas forzadas para recolectar los desechos. Aunque en la zona existen contenedores, muchos residuos terminan dispersos ante la falta de educación de la población y turistas. A pesar de sus esfuerzos, la basura reaparece y ellas tienen que retirarla de la playa, sobre todo ahora que llegan bañistas a Coatzacoalcos. “Recogemos toda la basura blanca, mantener limpio para cuando venga la gente de fuera y vea la playa limpia, bonita y permanezca así durante Semana Santa”, declaró Claudia. Las trabajadoras piden a los bañistas locales no tirar basura para que mejore la imagen del puerto sureño y así lleguen más turistas. “Que sean un poquito limpios, para que se vean más presentables los negocios, para que la gente se lleve una buena imagen de Coatzacoalcos, que cada semana se acuerden de Coatza y aquí los esperamos”, enfatizó la empleada del departamento de Limpia Pública. Además, durante estos días se colocaron “corrales” para que la gente deposite ahí sus residuos. Con ello, se espera reducir la cantidad de basura que al día siguiente recoge el personal del municipio.",https://www.alcalorpolitico.com/informacion/turistas-y-locales-dejan-sucias-la-playa-y-el-malecon-de-coatzacoalcos-423746.html,"Coatzacoalcos, Ver",18/04/2025
Hallan cuerpo flotando en el Lago de Catemaco,"Catemaco, Ver. 18/04/2025","Este viernes fue hallado el cuerpo sin vida de un hombre, flotando en las aguas del Lago de Catemaco y hasta esta noche aún no ha sido identificado. Personas que caminaban sobre el malecón, a la altura de “La Plazuela del Carmen”, fueron quienes observaron el cuerpo e informaron a la policía. Las autoridades dieron a conocer que se trataba del cuerpo de un hombre de entre 45 y 50 años de edad, que vestía camisa gris e indicaron que a simple vista no presentaba huellas de violencia. Tras asegurar el perímetro a varios metros de distancia, autoridades ministeriales acudieron al sitio y realizaron las diligencias periciales. Hasta la noche de este viernes, el cuerpo se encuentra en calidad de desconocido, en la unidad del Servicio Médico Forense, en Catemaco. Será a través de necropsia de rigor que se determine las causas de su muerte.",https://www.alcalorpolitico.com/informacion/hallan-cuerpo-flotando-en-el-lago-de-catemaco-423774.html,"Catemaco, Ver",18/04/2025
