titulo,fecha,articulo,url,lugar,fecha_limpia
"Asesinan a balazos a taquero en la colonia El Pueblito, en Córdoba","Córdoba, Ver. 20/04/2025","Un taquero identificado como José Enrique ""N"", (a) ""El Chino"", de 22 años de edad, fue asesinado en los últimos minutos del sábado de Gloria, al ser atacado a balazos cuando se encontraba afuera de un domicilio lo cual generó la movilización de las autoridades, así como del personal de los servicios de emergencia. Los hechos ocurrieron sobre la avenida Principal y calle Bravo de la colonia El Pueblito cuando el ahora occiso se encontraba afuera de su domicilio y fue sorprendido por hombres armados los cuales sin mediar palabra le dispararon hasta privarlo de la vida. Tras lo ocurrido arribaron elementos de la Policía Estatal y Municipal, quienes al confirmar que la persona estaba sin vida acordonaron el área resguardándola siguiendo el protocolo de cadena de custodia. Posteriormente llegaron elementos de la Fiscalía Regional de Justicia así como personal de los servicios periciales, quienes tomaron conocimiento de los hechos y de las diligencias correspondientes además de ordenar que el cuerpo fuera enviado al SEMEFO para la necropsia de rigor a su vez que integraron una carpeta de investigación por estos hechos.",https://www.alcalorpolitico.com/informacion/asesinan-a-balazos-a-taquero-en-la-colonia-el-pueblito-en-cordoba-423823.html,"Córdoba, Ver",20/04/2025
"Con domingo de Resurrección, Arzobispo de Xalapa inicia los 50 días de Pascua","Xalapa, Ver. 20/04/2025","Este domingo de resurrección el arzobispo de la Arquidiócesis de Xalapa, Jorge Carlos Patrón Wong, dio inicio en la Catedral Metropolitana a los 50 días de Pascua. “Iniciamos el tiempo más largo y más bello de la liturgia de la iglesia católica, el tiempo de Pascua, 50 días de gozo, de alegría, de ir descubriendo la presencia de Cristo vivo y resucitado”, comentó. En este sentido, expresó que este domingo de Pascua, día de Pentecostés, permanecerán vestidos de blanco, llenos de luz para significar la presencia viva, dominante de Cristo resucitado. Pidió unirse en oración con las personas enfermas así como por las vocaciones sacerdotales y de la vida consagrada. Además de colocar en el altar de Cristo resucitado las inquietudes, deseos y necesidades de todas las familias. “Señor Dios todo poderoso, escucha las oraciones de tu pueblo ahora que recordamos la acción maravillosa de nuestra creación y la maravilla aún más grande, que es la redención. Dígnate a bendecir esta agua, la creaste para ser fecunda la tierra y para favorecer nuestros cuerpos con el frescor y la limpieza. La hiciste también instrumento de misericordia al librar a tu pueblo de la esclavitud y al apagar con ella su sed en el desierto, por los profetas la revelaste como signo de la nueva alianza que quisiste sellar con los hombres y cuando Cristo descendió a ella en el Jordán, renovaste nuestra naturaleza pecadora en el baño de un nuevo nacimiento. Que esta agua señor avive en nosotros el recuerdo de nuestro bautismo y nos haga participar en el gozo de nuestros hermanos bautizados en la Pascua”, acotó.",https://www.alcalorpolitico.com/informacion/con-domingo-de-resurreccion-arzobispo-de-xalapa-inicia-los-50-dias-de-pascua-423825.html,"Xalapa, Ver",20/04/2025
"En Omealca, hombre mató a bebé al dormir ebrio sobre ella; la usó “de almohada”","Amatlán, Ver. 20/04/2025","La Fiscalía Especializada en Investigación de Delitos de Violencia Contra la Familia, Mujeres, Niñas y Niños y de Trata de Personas informó sobre la detención de Eduardo ""N"", originario de la comunidad de La Palma, municipio de Omealca, quien mató a su hija de tres meses de edad al dormir ebrio sobre ella. Fue el pasado 18 de abril, cuando este sujeto se quedó al cuidado de la menor, mientras la madre trabajaba el turno de noche en un establecimiento de autoservicio. Sin embargo, según se reportó, esa noche Eduardo ""N"", se alcoholizó en exceso, se fue a dormir y utilizó a su propia hija como almohada, provocándole la muerte por asfixia. En un comunicado, la Fiscalía informó que el juez le dictó prisión preventiva oficiosa como medida cautelar, dentro del proceso penal 106/2025, por el delito de feminicidio. Cabe destacar que la detención fue realizada por personas que llegaron al domicilio y encontraron al individuo dormido, sin mostrar remordimiento alguno, sobre el cuerpo sin vida de la menor. Estas personas lo entregaron a la Policía Naval. La necropsia reveló que la causa de muerte fue una fuerte presión que le impidió respirar, producto del peso del padre en estado de ebriedad, quien en lugar de proteger a su hija, se embriagó al punto de no tener conciencia de sus actos. A pesar de que su defensa argumentó que se trató de un homicidio culposo o una omisión de cuidados, el asesor jurídico de la madre, Uriel Moreno Mendoza, quien la auxilió de manera gratuita, presentó los elementos necesarios para que el sujeto fuera imputado y posteriormente vinculado a proceso por feminicidio. Ya se encuentra internado en el penal de mediana seguridad de La Toma, desde donde enfrentará su proceso legal.",https://www.alcalorpolitico.com/informacion/en-amatlan-hombre-mato-a-bebe-al-dormir-ebrio-sobre-ella-la-uso-de-almohada--423836.html,"Amatlán, Ver",20/04/2025
Coatzacoalcos mantiene saldo blanco durante vacaciones,"Coatzacoalcos, Ver. 20/04/2025","Saldo blanco se ha reportado en los primeros ocho días de la Semana Santa en Coatzacoalcos, confirmó el director de Protección Civil, David Esponda Cruz. El sábado, con ayuda de ciudadanos, la valla de pescadores, Protección Civil y la Policía Estatal, se logró evitar que un par de jóvenes se ahogaran en la playa. El funcionario aseguró que, gracias a la acción rápida de las autoridades y la ciudadanía que se sumó a las labores, se evitó la tragedia. “Hasta el momento hemos estado en saldo blanco estos días desde el domingo que comenzamos con el operativo de las playas de Coatzacoalcos, no hemos tenido nada que lamentar”, informó. Reiteró que se continuará dando información a la población respecto a las banderas que indican si se puede ingresar o no al mar. “Que hagan caso a las indicaciones que dan las autoridades, esperamos continuar con saldo blanco. Hoy domingo terminamos con lo más fuerte de esta Semana Santa y esperamos poder dar un resultado la próxima semana”, finalizó.",https://www.alcalorpolitico.com/informacion/coatzacoalcos-mantiene-saldo-blanco-durante-vacaciones-423840.html,"Coatzacoalcos, Ver",20/04/2025
"Tras protesta, taxistas de Orizaba lograron acuerdo con SSP","Orizaba, Ver. 20/04/2025","Luego de la protesta realizada por taxistas hace un mes contra los abusos de elementos de la Secretaría de Seguridad Pública (SSP) con base en Huiloapan, se logró establecer un canal de comunicación directa con el director operativo de la zona centro, informó el asesor de los trabajadores del volante, Jairo Guarneros Sosa. Detalló que ahora podrán reportar cualquier abuso directamente al mando regional, especialmente los cometidos por oficiales adscritos a la base de Los Colorines. Añadió que, en el caso de un conductor detenido y sancionado de forma indebida, se le reembolsó el dinero que los policías habían solicitado a su familia. Sin embargo, advirtió sobre la falta de control por parte del Ayuntamiento de Huiloapan sobre estos oficiales, quienes sólo obedecen al delegado de su base y no colaboran con las autoridades municipales, a pesar de que se han presentado situaciones en las que se les ha solicitado apoyo de forma directa. No obstante, comentó que “mientras hay policías que atropellan derechos, Huiloapan queda sin vigilancia efectiva”. Recordó, además, que por instrucciones del titular de la Secretaría de Seguridad Pública (SSP), no deben realizarse operativos, ya que estos han derivado en actos de extorsión y abusos.",https://www.alcalorpolitico.com/informacion/tras-protesta-taxistas-de-orizaba-lograron-acuerdo-con-ssp-423837.html,"Orizaba, Ver",20/04/2025
Católicos celebran el Domingo de Resurrección,"Xalapa, Ver. 20/04/2025","Este 20 de abril, la comunidad católica celebra el Domingo de Resurrección, la fiesta más importante del calendario litúrgico cristiano. Después del recogimiento vivido en la Semana Santa, la Resurrección de Cristo representa la victoria de la vida sobre la muerte, el triunfo del amor sobre el pecado, y la renovación de la fe en la promesa divina. El Domingo de Resurrección pone fin al Triduo Pascual —que comprende el Jueves Santo, el Viernes Santo y el Sábado de Gloria—, y da inicio al tiempo pascual, un periodo de 50 días que culmina con la fiesta de Pentecostés. En Xalapa, la capital del Estado, las iglesias se preparan para recibir a cientos de fieles con diversas celebraciones eucarísticas, actividades litúrgicas y momentos de convivencia familiar. Desde tempranas horas del domingo, parroquias como la Catedral Metropolitana, Cristo Rey, San José, El Calvario y María Auxiliadora ofrecerán misas solemnes, muchas de ellas acompañadas de música, flores y símbolos de luz como el cirio pascual, encendido la noche anterior durante la Vigilia. Algunas parroquias también realizarán procesiones cortas, bendición de alimentos, encuentros comunitarios y actividades especiales para niños, con el fin de fomentar el sentido de la resurrección como experiencia de alegría y renovación. Para muchos xalapeños, este día no sólo es un recordatorio espiritual, sino también una oportunidad para reencontrarse con sus familias, compartir alimentos tradicionales y comenzar la semana con esperanza renovada.",https://www.alcalorpolitico.com/informacion/catolicos-celebran-el-domingo-de-resurreccion-423820.html,"Xalapa, Ver",20/04/2025
Calor incrementa consumo de energía en restaurantes de Orizaba,"Orizaba, Ver. 20/04/2025","Debido a que las altas temperaturas hacen necesario que en los restaurantes se utilicen climas y ventiladores, de abril a junio el consumo de energía eléctrica se dispara hasta en un 40 por ciento, señaló el presidente de la Cámara Nacional de la Industria de Restaurantes y Alimentos Condimentados (CANIRAC) en Orizaba, Carlos Cruz Mendoza. Indicó que, al ser los meses más calurosos del año, los establecimientos tienen que mantener encendidos ventiladores y aires acondicionados durante extensas jornadas para brindar un ambiente agradable a sus clientes. Cruz Mendoza explicó que, aunque representa un gasto adicional, este confort puede traducirse en mayor permanencia del comensal y un aumento en el consumo promedio. Además, destacó la importancia de contemplar este gasto dentro del presupuesto anual, considerando que este año se esperan al menos cinco ondas de calor.",https://www.alcalorpolitico.com/informacion/calor-incrementa-consumo-de-energia-en-restaurantes-de-orizaba-423838.html,"Orizaba, Ver",20/04/2025
Fin de semana santo llenó la playa de Chachalacas,"Úrsulo Galván, Ver. 20/04/2025","Este domingo, la playa de Chachalacas continuó luciendo llena desde la Bocana del Río Actopan hasta las dunas de este importante destino turístico del estado de Veracruz. Al ingreso y salida del lugar se formaron largas filas, mientras que Tránsito del Estado, con sede en Cardel, mantuvo un operativo vial en diferentes puntos estratégicos para agilizar la circulación. En este Domingo de Resurrección, los visitantes disfrutaron hasta el último momento del buen clima durante el fin de semana en Úrsulo Galván. Muchos comenzarán su viaje de retorno alrededor de las 19:00 horas, hacia diferentes puntos del estado de Veracruz, así como a la Ciudad de México, Tlaxcala, Puebla, Tamaulipas, Morelos, Chihuahua, entre otras entidades. La fuerza de tarea que participa en este operativo vacacional de Semana Santa 2025 está conformada por la Secretaría de Protección Civil de Veracruz, la Secretaría de Marina (SEMAR), Protección Civil Municipal, la Unidad Marítima de la Secretaría de Seguridad Pública (SSP) y el DIF Municipal, quienes continuarán al pendiente hasta el 27 de abril. De acuerdo con el reporte preliminar de las autoridades, se han registrado más de 10 rescates acuáticos, ocho menores extraviados que fueron entregados a sus familiares, así como diversas atenciones médicas. Visitantes provenientes de estados como Puebla, Tlaxcala y la Ciudad de México encabezan los casos de rescates acuáticos, además de reportarse pleitos entre familiares, desobediencia en el manejo de cuatrimotos y vehículos tipo RZR, y extravío de menores. Hasta la tarde de est domingo, se mantenía el saldo blanco.",https://www.alcalorpolitico.com/informacion/fin-de-semana-santo-lleno-la-playa-de-chachalacas-423833.html,"Úrsulo Galván, Ver",20/04/2025
Continúan rescatando a turistas de CDMX en Playa de Chachalacas,"Chachalacas/Úrsulo Galván, Ver. 20/04/2025","Desconocen la zona y desobedecen indicaciones, la corriente los jala, o también nadan cerca de escolleras consideradas punto peligroso. Unidad Marítima de SSP con base en Chachalacas rescató del Mar a una joven de CDMX, continúa la fuerza de tarea del Operativo Semana Santa. Participando tres niveles de gobierno.",https://www.alcalorpolitico.com/informacion/continuan-rescatando-a-turistas-de-cdmx-en-playa-de-chachalacas-423824.html,"Chachalacas/Úrsulo Galván, Ver",20/04/2025
"Se incendiaron dos viviendas, en San Andrés Tuxtla","San Andrés Tuxtla, Ver. 20/04/2025","La tarde de este domingo se registró el incendio de dos viviendas en el barrio Campeche de San Andrés Tuxtla, sin que se reportaran personas lesionadas, únicamente crisis nerviosa. Fue alrededor de las 17:00 horas cuando se reportó a los cuerpos de emergencia sobre el incendio de una casa en la calle 4 Ciénegas, casi esquina con Justo Sierra, en el barrio antes citado. Tras el arribo de los cuerpos de auxilio y de seguridad, se percataron de que se trataba de dos viviendas las que se estaban incendiando, una de ellas construida de madera y lámina, mientras el fuego amenazaba con avanzar a una tercera casa. Vecinos que se percataron del fuego en la primera vivienda acudieron de inmediato a tratar de sofocar las llamas con cubetas con agua, abastecidas desde tinacos, tuberías y albercas inflables que estaban siendo utilizadas por algunos residentes. Aunque no lograron extinguir el fuego, sí lograron contenerlo por algunos minutos en lo que llegaban los cuerpos de auxilio. Al sitio arribaron elementos del cuerpo de Bomberos, Protección Civil y personal de Soporte Vital, quienes finalmente controlaron la situación. Los paramédicos atendieron a una mujer de 71 años y a un hombre de 73, quienes sufrieron crisis nerviosa. Finalmente, el saldo fue una vivienda totalmente reducida a escombros, otra más parcialmente afectada, mientras que una tercera sólo resultó con daños en la fachada.",https://www.alcalorpolitico.com/informacion/se-incendiaron-dos-viviendas-en-san-andres-tuxtla-423839.html,"San Andrés Tuxtla, Ver",20/04/2025
No debemos acostumbrarnos a la violencia: Obispo de Orizaba,"Orizaba, Ver. 20/04/2025","El obispo Eduardo Cervantes Merino señaló que es necesario reconstruir el mundo violento en el que vivimos, donde las cifras sobre actos delictivos se acomodan según la conveniencia de cada quien, y donde no se quiere ver el dolor que la inseguridad, las desapariciones y otros problemas continúan causando. ""Cada quien tiene sus propios datos, no podemos acostumbrarnos a ver a las mamás de los desaparecidos buscando entre escombros, entre fosas, a sus seres queridos. Qué triste, hermanos, ver tanto movimiento de migración. Porque hay situaciones dolorosas en el entorno y así podemos seguir repasando situaciones dolorosas, como el trato de la familia, en las relaciones humanas, la violencia en la familia, en el trato no adecuado a la mujer, a la dignidad"", dijo. Durante la misa del Domingo de Resurrección, exhortó a pedir a Dios que ""nos ayude a mover esa piedra como en el sepulcro, que permita construir un mundo diferente donde no seamos indiferentes a la violencia, a la injusticia"", dijo. El Prelado pidió a los fieles poner en práctica el Evangelio y buscar hacer el bien, así como procurar relaciones que permitan cada día funcionar como personas en un trato digno, respetuoso, atento y con el ánimo de ser mejores.",https://www.alcalorpolitico.com/informacion/no-debemos-acostumbrarnos-a-la-violencia-obispo-de-orizaba-423834.html,"Orizaba, Ver",20/04/2025
"Tras apagón, Catedral de Veracruz Puerto buscará tener planta generadora","Veracruz, Ver. 20/04/2025","Tras el apagón que se registró la noche del sábado en el Centro Histórico de Veracruz, incluida la Catedral de Nuestra Señora de la Asunción, el obispo de la Diócesis de Veracruz, Carlos Briseño Arch, explicó que el recinto debe contar con una planta generadora de energía. Precisó que sí contaban con una, pero fue trasladada; sin embargo, ante este tipo de casos, es necesaria.“Tenemos una planta, pero se la llevaron, vamos a tratar de conseguir otra, yo creo que pronto ya vamos a acomodar una plantilla por ahí para tenerla porque sí hace falta”, dijo. El Obispo señaló que la misa del Sábado de Gloria no se afectó porque la primera parte de la liturgia es a oscuras, apoyados por la iluminación de velas; sin embargo, los asistentes padecieron por las altas temperaturas. La energía eléctrica regresó justo en la parte de la celebración cuando tradicionalmente se enciende la luz. “La celebración empieza a oscuras, dijimos aquí nos vamos a morir de calor, pero dijimos vamos a empezare como se empieza siempre, con la iglesia a oscuras porque no había luz, toda la primera parte estuvimos a oscuras, como siempre se está y cuando empieza en donde se enciende todo, resulta que viene la luz”, agregó. La falta de energía eléctrica duró aproximadamente 45 minutos la noche del sábado.",https://www.alcalorpolitico.com/informacion/tras-apagon-catedral-de-veracruz-puerto-buscara-tener-planta-generadora-423829.html,"Veracruz, Ver",20/04/2025
"""Si va uno al bosque, no se deben hacer fogatas”","Orizaba, Ver. 20/04/2025","El alpinista y brigadista Hilario Aguilar, conocido como el ""Jefe Layo"", aseveró que es una inconsciencia por parte de la población acudir de día de campo a la montaña y realizar fogatas, ya que en esta temporada representan un alto riesgo de provocar incendios forestales. ""En los bosques nunca se deberían de hacer fogatas, una chispa puede ocasionar alguna tragedia muy grande, además no vemos que no solo se pierde parte del bosque, sino que mueren animalitos desde los microscópicos hasta especies grandes, y eso ya ha sucedido en los incendios que se han registrado durante esta temporada"", dijo. Agregó que es preocupante recorrer zonas afectadas por siniestros y no escuchar el canto de aves u otros sonidos característicos de la fauna silvestre. ""Si va uno al bosque, no se deben hacer fogatas; hay lugares especiales a campo abierto donde se pueden hacer, aunque siempre se deben de mitigar las fogatas, que no quede nada, taparla con tierra y agua, pero que no se deje vivo el fuego"", expresó. También destacó que algunas personas que visitan la montaña dejan botellas de vidrio, las cuales actúan como lupa y pueden originar incendios. Asimismo, señaló que el pastoreo es otra práctica que está afectando los bosques, pues algunos productores prenden fuego para acelerar el rebrote del pasto y alimentar a sus animales; sin embargo, cuando las quemas se salen de control, provocan conflagraciones. Resaltó que la mayor parte de los incendios forestales son provocados por la mano humana.",https://www.alcalorpolitico.com/informacion/-si-va-uno-al-bosque-no-se-deben-hacer-fogatas--423835.html,"Orizaba, Ver",20/04/2025
Información de Veracruz ya ni aparece en Plataforma Nacional Anticorrupción,"Xalapa, Ver. 20/04/2025","Durante este 2025, Veracruz “se desconectó” de la Plataforma Digital Nacional (PDN), pues ninguna de sus 325 instituciones está reportando información. Cabe señalar que la PDN debería permitir a las autoridades del Sistema Nacional Anticorrupción consultar, en tiempo real, información sobre servidores públicos, contrataciones, sanciones administrativas y denuncias por corrupción. La plataforma, desarrollada por la Secretaría Ejecutiva del Sistema Nacional Anticorrupción (SESNA), no cuenta con información del Poder Ejecutivo, del Legislativo, del Judicial, de los organismos autónomos ni de los municipios veracruzanos. Desde el último informe, de julio a septiembre de 2024, Veracruz reportaba el cumplimiento del 100 por ciento de la normatividad, capital humano contratado y 87 por ciento de interconexión. Sin embargo, durante los dos reportes posteriores, la entidad dejó de aportar información a la PDN. En la etapa final de la administración de Cuitláhuac García Jiménez, la Secretaría Ejecutiva del Sistema Estatal Anticorrupción había cubierto el 50 por ciento de la normatividad exigida y alcanzado un 80 por ciento de interconexión. Entonces, persistían rezagos en la carga de información sobre las declaraciones fiscales de los servidores públicos involucrados en contrataciones, así como sobre funcionarios y particulares sancionados por irregularidades. En enero de ese año, la secretaria Técnica del SEA, Adriana Paola Linares Capitanachi, aseguró que Veracruz lograría en breve la interconexión total con la PDN. Hay que destacar que, a la fecha, la propia Secretaría Ejecutiva del Sistema Estatal Anticorrupción incumple con el sistema de declaraciones, el de los servidores públicos en contrataciones, el de sancionados, así como el de contrataciones.",https://www.alcalorpolitico.com/informacion/informacion-de-veracruz-ya-ni-aparece-en-plataforma-nacional-anticorrupcion-423830.html,"Xalapa, Ver",20/04/2025
"En Río Blanco, sancionarán por quemas que se salgan de control","Río Blanco, Ver. 20/04/2025","Con la finalidad de prevenir incendios forestales y urbanos, el Ayuntamiento de Río Blanco anunció la aplicación de sanciones para los propietarios de terrenos en mal estado y para quienes realicen quemas que se salgan de control. El alcalde Ricardo Pérez García explicó que la mayoría de los incendios no son simples accidentes, sino consecuencia de la falta de medidas de seguridad adecuadas al momento de realizar quemas. Recordó que las condiciones actuales del clima, con altas temperaturas y fuertes vientos, favorecen la rápida propagación del fuego, por lo que cualquier quema puede convertirse en un incendio de gran magnitud. Además, puntualizó que estas acciones irresponsables no solo dañan el medio ambiente, sino que también ponen en peligro a voluntarios, socorristas y personal de emergencia que arriesgan su vida al combatir el fuego. Consideró que en los tres primeros años de la administración se han dedicado a concientizar a la población y también a realizar el reglamento correspondiente, porque lo que ahora sólo queda aplicar mano dura para que en el municipio no haya incendios que afecten al entorno y a la población.",https://www.alcalorpolitico.com/informacion/en-rio-blanco-sancionaran-por-quemas-que-se-salgan-de-control-423827.html,"Río Blanco, Ver",20/04/2025
La Pascua es el corazón del año litúrgico y el fundamento de la fe cristiana,"Xalapa, Ver. 20/04/2025","Este Domingo de Resurrección, el mensaje que recorre los hogares católicos en Xalapa y en todo el mundo es uno: ¡Verdaderamente ha resucitado el Señor! La Pascua no es sólo la culminación de la Semana Santa, sino el corazón del año litúrgico y el fundamento de la fe cristiana, expresó el presbítero José Manuel Suazo Reyes. Explicó que esta celebración es una experiencia luminosa que transforma la visión de la vida: “La fiesta de la Pascua es la celebración más importante de todo el año litúrgico, en ella se funda nuestra fe. Es una fiesta de luz, ya que el Señor resucitado nos ilumina y ayuda a entender todos los acontecimientos.” Durante este día, los fieles reviven los relatos evangélicos, como el del evangelio de san Juan, que narra cómo María Magdalena encuentra la tumba vacía. Según el presbítero, la resurrección fue un hecho inesperado para los discípulos, y sólo al aparecerse Jesús en persona pudieron comprender su dimensión divina. “La resurrección de Jesús nos muestra el valor de su pasión; gracias a ella comprendemos que la muerte en cruz, lejos de ser una derrota, es más bien una victoria del amor”, agregó Suazo Reyes. Además del simbolismo espiritual, las iglesias han preparado una jornada de celebración con misas solemnes, cantos, encendido del cirio pascual y momentos comunitarios que invitan a vivir esta victoria del amor como una renovación personal y colectiva. Para la Iglesia, esta Pascua no es sólo memoria, es presencia: Cristo vive, y su luz sigue siendo guía para quienes buscan esperanza, sentido y vida, finalizó Suazo Reyes.",https://www.alcalorpolitico.com/informacion/la-pascua-es-el-corazon-del-anio-liturgico-y-el-fundamento-de-la-fe-cristiana-423822.html,"Xalapa, Ver",20/04/2025
"Aseguraron a 12 centromericanos, en Orizaba; estaban en central de AU","Orizaba, Ver. 20/04/2025","Doce personas de origen centroamericano fueron detenidas en un operativo instruido por el Instituto Nacional de Migración (INM), en coordinación con instancias de los tres órdenes de Gobierno. Se informó que, una vez examinados por el personal médico, los ciudadanos centroamericanos serán repatriados a su lugar de origen, atendiendo los protocolos internacionales.",https://www.alcalorpolitico.com/informacion/aseguraron-a-12-centromericanos-en-orizaba-estaban-en-central-de-au-423842.html,"Orizaba, Ver",20/04/2025
