titulo,fecha,articulo,url,lugar,fecha_limpia
"Sicarios sorprenden a hombre en su casa y lo asesinan a balazos, en Tuxpan","Tuxpan, Ver. 21/04/2025","Hombres armados que se desplazaban en una motocicleta sorprendieron a una persona en la cochera de su domicilio, en Calle 1 del fraccionamiento Jesús Reyes Heroles, en esta ciudad de Tuxpan, donde lo asesinaron de al menos 5 balazos. De manera extraoficial ha trascendido que la víctima es el empresario farmacéutico Nabor Machorro, de 61 años, aunque las autoridades no han emitido declaraciones en torno al caso. El sitio del crimen fue acordonado por elementos de la Policía Municipal, Secretaría de Seguridad Pública del Estado, Guardia Nacional y Secretaría de la Defensa Nacional, en tanto que peritos de la Fiscalía General del Estado y agentes de la Policía Ministerial realizaron el levantamiento del cuerpo. Tras el ataque, ocurrido cerca del Colegio Euroamericano, en la citada zona residencial, se realizó un intenso movimiento de elementos de distintas corporaciones, pero sin reporte de detenciones. Esta es la cuarta ejecución en un lapso menor a los 30 días; el 24 de marzo en un ataque armado en la zona restaurantera de La Mata de Tampamachoco fue asesinado el propietario del restaurante “El Timón”, Josué “N”, a quien sorprendieron frente a su domicilio. El 9 abril, también en la misma zona restaurantera rumbo a la playa, sujetos armados abrieron fuego contra una pareja en la calle Ribera del Pescador, frente al restaurante “El Canto de la Sirena”. En el ataque murió un masculino y una mujer resultó herida. Dos días después, el 11 de abril el conocido luchador agrario, Rubén Cruz Sagastume, fue asesinado en su oficina en calle Niño Artillero, en plena zona centro y a unos metros del Cuartel de la 19ª Zona Militar, y aunque sobre este caso la gobernadora Rocío Nahle informó que el homicida ha sido identificado, hasta ahora no se ha dado a conocer la detención.",https://www.alcalorpolitico.com/informacion/sicarios-sorprenden-a-hombre-en-su-casa-y-lo-asesinan-a-balazos-en-tuxpan-423878.html,"Tuxpan, Ver",21/04/2025
Sufre tesista de Derecho UV nuevas irregularidades en su proceso de titulación,"Xalapa, Ver. 21/04/2025","Brayan Hernández Gayosso, estudiante de la Facultad de Derecho región Xalapa de la Universidad Veracruzana (UV), denunció nuevas irregularidades en su proceso de titulación. Esto después de la cancelación de su examen profesional y de la convocatoria a una Junta Académica Extraordinaria, la cual asegura, que tiene el propósito de sancionarlo “por sus actitudes y agresiones”. El joven fue citado a dicha junta para este lunes 21 de abril a las 15:00 horas, sin embargo, esta fue cancelada 43 minutos antes mediante un correo electrónico enviado a las 14:17. “Me lo hicieron saber hasta las 2:17 por medio de correo electrónico. No hubo ninguna notificación personal, incluso cuando la solicité en la Dirección, únicamente me dijeron que ya me la habían enviado a mi correo”, declaró. Hernández Gayosso acudió a la Facultad para pedir constancia formal de la cancelación y tomó una fotografía del documento en la Dirección. No obstante, al acudir con el secretario académico para solicitar una copia oficial, se le respondió que “ya estaba en su correo”. La convocatoria a la junta extraordinaria se sustentaba en los artículos del Estatuto de Alumnos de la UV y señalaba como propósito resolver la “conducta suscitada” el 10 de abril, día en que fue cancelado su examen profesional programado para las 18:00 horas. El día del examen, según su testimonio, dos de los sinodales estaban presentes y la cancelación fue determinada por la directora Araceli Reyes López, quien argumentó que uno de los jurados estaba de licencia y otro no asistiría. Brayan propuso continuar con los presentes o nombrar a un sustituto, pero ambas opciones fueron descartadas. “Yo le solicito que me permita realizar mi exposición oral frente a los dos sinodales que están presentes y que mi tesis sea aprobada por mayoría, la directora también rechaza mi propuesta”, narró. El afectado agregó que, en el oficio donde se le notificó la fecha del examen, “ya se establecía que su tesis había sido aprobada y que, en dado caso de que los miembros del jurado no pudieran asistir, se cubriera su ausencia, cosa que no hicieron, por lo cual mi protesta pacífica”, aseguró. Como forma de protesta, el egresado permaneció en la entrada de la Dirección, lo cual derivó en que se solicitara la intervención de guardias de seguridad. Hernández asegura que nunca incurrió en violencia. “La directora solicita la presencia de los guardias de la Facultad argumentando que la estoy privando de la libertad (...), ellos ingresan a Dirección y me indican que me retire, a lo cual yo les expreso que no pueden retirar a un alumno de su propia institución educativa”. Durante la protesta acudieron familiares y amistades del tesista. La Defensoría de los Derechos Universitarios le informó que la Dirección había notificado la cancelación del examen, razón por la cual no se presentó el observador universitario previamente solicitado. Hernández reiteró que esa contradicción vulneró su derecho a una titulación justa. Más tarde, en una mesa de diálogo con representantes de la oficina del Abogado General y el secretario académico general, la Directora y un académico aseguraron haber sido agredidos por el egresado, situación que éste negó. La Dirección de la Facultad fundamentó la suspensión del acto académico señalando la falta de votos aprobatorios de la tesis, aunque Hernández sostiene que su trabajo fue validado formalmente y que el acta de aprobación incluía la fecha y hora del examen. Finalmente, tras el incidente, Hernández denunció que personal de la Facultad intentó notificarle nuevamente ingresando sin permiso al inmueble donde habita. “Yo les expreso que es propiedad privada, que no pueden ingresar (...) ellos se retiran y yo acudo a la puerta para recibir la notificación”, relató.",https://www.alcalorpolitico.com/informacion/sufre-tesista-de-derecho-uv-nuevas-irregularidades-en-su-proceso-de-titulacion-423898.html,"Xalapa, Ver",21/04/2025
Cuitláhuac le dejó a Nahle deudas con el SAT,"Xalapa, Ver. 21/04/2025","Deudas con el fisco heredó la administración de Cuitláhuac García Jiménez a su sucesora, Rocío Nahle García, en al menos 6 dependencias, dio a conocer el Servicio de Administración Tributaria (SAT).",https://www.alcalorpolitico.com/informacion/cuitlahuac-le-dejo-a-nahle-deudas-con-el-sat-423869.html,"Xalapa, Ver",21/04/2025
"Ocupación de palapas no se reflejó en buenas ventas, en Veracruz Puerto","Veracruz, Ver. 21/04/2025","Durante la primera semana de la temporada vacacional se tuvo incremento promedio de ventas en la zonas de palapas de Villa del Mar del 60 por ciento, indicó Víctor Morales Azamar. El único día que se llegó al tope de comensales fue el sábado de gloria, aunque sí hubo turismo los demás días, no se reflejó en las ventas. Tras la Semana Santa, la expectativa se pone en el fin de semana largo por el día del trabajo. El empresario, precisó que muchos llegan pero con las tortas y sus cervezas, rentan mesas, pero no consumen. “Vino mucha gente, sí vino mucha gente pero ellos venían nada más a la playa, a alquilar mesas y todo eso y cuando tú estás mirando que están alquilando todas esas mesas, tú dices eso ya va mal (...) es poca la gente que viene con anafre pero sí con su bolsa de tortas. Yo atendí a unas personas el sábado con un ‘mesononón’ de 15 personas. Pidieron como 10 refrescos y ya no pidieron más. Y sacaron sus cervezas”, indicó. Durante esta semana de pascuas las ventas caen nuevamente y se recuperan el último fin de semana de la temporada vacacional. “El Domingo de Ramos al jueves, vamos a poner al miércoles, tuvimos un 20 por ciento de gente, de venta y todo. La verdad estuvo muy baja. El jueves se medio compuso. El viernes más o menos, que era el mejor día y sin embargo se vendió algo. El sábado cerramos con broche de oro, la verdad, hubo un mundo de gente y la verdad nos fue muy bien a todos. Ayer domingo no vino ni la mitad de gente que vino el sábado”.",https://www.alcalorpolitico.com/informacion/ocupacion-de-palapas-no-se-reflejo-en-buenas-ventas-en-veracruz-puerto-423877.html,"Veracruz, Ver",21/04/2025
Francisco falleció por derrame cerebral y fallo cardio-circulatorio irreversible,Ciudad del Vaticano. 21/04/2025,"El papa Francisco falleció este lunes con 88 años de edad a causa de un ictus cerebral que le causó un coma y un fallo cardio-circulatorio irreversible, según informó el Vaticano en su parte de defunción. Según el parte, firmado por el director de Sanidad e Higiene del Estado de la Ciudad del Vaticano, Andrea Arcangeli, la muerte se produjo a las 7:35 horas locales del 21 de abril en su apartamento, la residencia vaticana Casa Santa Marta. Francisco murió tras más de 2 meses padeciendo unos problemas respiratorios graves que le obligaron a permanecer ingresado en el hospital Gemelli de Roma durante 38 días, hasta el 23 de marzo. Según su historial, Francisco había padecido un episodio de insuficiencia respiratoria aguda por una neumonía bilateral microbiótica, así como una bronquitis múltiple, hipertensión y diabetes. La defunción ha sido constatada mediante un electrocardiograma. “Declaro que las causas de la muerte según mi ciencia y conciencia son las indicadas”, se lee en el boletín. Asimismo, el Vaticano señaló que el Papa dejó en el testamento su voluntad de una tumba sencilla en Santa María la Mayor. “Pido que se prepare mi tumba en el nicho sepulcral de la nave lateral entre la Capilla Paulina (Capilla de la Salus Populi Romani) y la Capilla Sforza de la Basílica (Santa María la Mayor), como se indica en el plano adjunto”, señala el testamento papal. “La tumba debe estar en el suelo; simple, sin ornamentación particular, llevando sólo la inscripción: Franciscus”, indicó. “Los gastos de preparación de la sepultura se cubrirán con una suma proporcionada por un benefactor, que he dispuesto que se transfiera a la Basílica Papal de Santa María la Mayor. He dado las instrucciones necesarias al respecto del cardenal Rolandas Makrickas, comisario extraordinario de la basílica liberiana”.",https://www.alcalorpolitico.com/informacion/francisco-fallecio-por-derrame-cerebral-y-fallo-cardio-circulatorio-irreversible-423875.html,Ciudad del Vaticano,21/04/2025
En elección municipal se marcará con tinta indeleble el pulgar izquierdo: INE,"Xalapa, Ver. 21/04/2025","En Veracruz y Durango, durante la votación del 1 de junio, los funcionarios de casilla marcarán con tinta indeleble el dedo pulgar izquierdo para la elección de ayuntamientos y el pulgar derecho para la elección de juzgadores del Poder Judicial. Al manifestar lo anterior, Josué Cervantes Martínez vocal Ejecutivo de la Junta Local del INE, descartó que se cometan errores a la hora de marcar los pulgares de los ciudadanos. Dijo que en estos momentos ya se capacita a los ciudadanos que salieron insaculados y aceptaron la invitación del INE para ser funcionarios de casilla. “Se está impartiendo un curso de capacitación a mayor profundidad, se hace énfasis sobre las particulares de la elección. Estamos siendo muy enfáticos que para el Poder Judicial se marca el pulgar derecho y para la elección de ayuntamientos el pulgar izquierdo”. Añadió que será decisión de cada ciudadano dónde votar primero, si se forma para la elección de ayuntamientos y después para el Poder Judicial, o primero para la elección de juzgadores y después para alcaldes. Además, cuando se vote por la elección del Poder Judicial tanto de la Federación como del Estado, la credencial se marcará en el recuadro de elecciones federales y para la elección de ayuntamientos en los recuadros de elecciones locales.",https://www.alcalorpolitico.com/informacion/en-eleccion-municipal-se-marcara-con-tinta-indeleble-el-pulgar-izquierdo-ine-423879.html,"Xalapa, Ver",21/04/2025
Quedó conformada la Corte Real del Carnaval Tuxpan 2025,"Tuxpan, Ver. 21/04/2025","La magia y el gran ambiente de las fiestas carnestolendas comenzó a sentirse en la ciudad con los certámenes para la elección de la Corte Real del Carnaval Tuxpan 2025, “La alegría eres tú”, que se celebrará del 1° al 5 de mayo. Entre porras y aplausos, familias enteras se reunieron en la plaza cívica para apoyar a las y los aspirantes a Reina, Rey de la Alegría, Reyes Infantiles y Rey y Reina LGBTQ+; así como a los Reyes PCD y Reyes Adulto Mayor, elegidos con antelación. El jurado calificador integrado por el diseñador creativo Humberto Cervantes; la maquillista profesional Marisa Knight; Miss Petite Ximena Negrete; el diseñador Jean Garcés y el Lic. Armando Ortiz Martínez, evaluaron el carisma y las aptitudes de cada participante para determinar a los triunfadores de las diferentes categorías. Así, se eligió Reina del Carnaval a Kathy Benítez y a Ricardo Sosa “Richie”, Rey de la Alegría. Además, Ana Leydi de Jesús y Mariana Torres son las princesas 1ª y 2ª, respectivamente. En la categoría infantil los ganadores fueron la reina Alexa 1ª y el rey Gael 1º; mientras que la pequeña Joely fue seleccionada princesa 1ª. La comunidad LGBTQ+ estará representada en esta celebración por la reina Krizsha 1ª y el rey Jesús Daniel 1º. Durante el evento se presentó a los Reyes de Adultos Mayores Margarita Gamundi y Roberto Santos; asimismo a la princesa Lidia Loya, todos ellos del club “Recordar es Vivir”. La Corte Real de Personas con Discapacidad (PCD) quedó conformada por Diana Monserrat 1ª y Diego Armando 1º, Reina y Rey PCD. Andrea Cobos y Alonso “Loncho” Pérez, son la princesa y el príncipe de esta misma categoría. En representación del alcalde Dr. Jesús Fomperoza Torres, en los certámenes estuvieron presentes el Lic. Juan Pablo Alcántar Alvarado, secretario técnico del Ayuntamiento de Tuxpan y la Lic. Valeria Loya Herrera, directora de Turismo Municipal. Además de reflejar la alegría de todas y todos, la edición 128 del Carnaval de Tuxpan impulsa la diversidad y fortalece la identidad de nuestra comunidad.",https://www.alcalorpolitico.com/informacion/quedo-conformada-la-corte-real-del-carnaval-tuxpan-2025-423864.html,"Tuxpan, Ver",21/04/2025
Dos cardenales mexicanos serán parte del cónclave que elegirá al nuevo Papa,"Orizaba, Ver. 21/04/2025","Carlos Aguiar Retes y José Francisco Robles Ortega, son los dos cardenales mexicanos electores. Es de recordar que el Cónclave está formado por dos tipos de cardenales: los electores, que son los que tienen menos de 80 años y tienen derecho a voto y también pueden ser elegibles y los no electores, que tienen más de 80 años y no tienen derecho a voto. Para el cónclave que se efectuara después de la muerte del Papa Francisco, hay 135 cardenales electores de 252 cardenales en total que existen. El Cardenal Carlos Aguiar Retes es arzobispo de la Arquidiócesis Primada de México, tiene 75 años. El cardenal José Francisco Robles Ortega, es arzobispo de Guadalajara y tiene 76 años.",https://www.alcalorpolitico.com/informacion/dos-cardenales-mexicanos-seran-parte-del-conclave-que-elegira-al-nuevo-papa-423851.html,"Orizaba, Ver",21/04/2025
Me ataca un presunto corrupto que hace berrinche: Paul Martínez,"Xalapa, Ver. 21/04/2025","El diputado local del distrito 9 con cabecera en Perote, Paul Martínez Marié, respondió públicamente a las acusaciones hechas por su correligionario, Randu Ortiz Herrera, quien denunció que el Legislador impuso a su hijo como candidato a la segunda regiduría en el proceso electoral local. A través de un video difundido en redes sociales, el Diputado negó que se trate de un caso de nepotismo y defendió el derecho de su hijo, de 19 años, a participar en la contienda. “Mi hijo va a participar porque es un derecho que tiene cualquier ciudadano a ser votado. No se trata de nepotismo, porque él tendrá que pasar por un filtro, que es el del pueblo, que tendrá que decidir si quieren o no que sea el regidor”, dijo. Acusa corrupción Sin aclarar si interpondrá una denuncia, Martínez Marié también acusó a Ortiz Herrera de tener una trayectoria marcada por derrotas electorales y por presuntos hechos de corrupción. “Tú ya perdiste tres elecciones, una para la Diputación local, incluso cuando iba en la boleta nuestro expresidente de la República, el licenciado Andrés Manuel López Obrador (…) y en otras 2 ocasiones donde también participó tu familia, no hablaste de nepotismo”, dijo. Además, el Diputado local afirmó que Randu Ortiz Herrera enfrenta múltiples señalamientos en los cargos en los que se ha desempeñado. “Me gustaría que aclararas también el por qué te corrieron de la Secretaría del Bienestar, el por qué te corrieron de ahí de donde estabas en SADER (Secretaría de Agricultura y Desarrollo Rural), el por qué se expresa tan mal los productores agrícolas de todo lo que les hiciste”, refirió. Martínez añadió que existen acusaciones sobre presuntas irregularidades cometidas por familiares de su correligionario durante su paso por programas sociales: “Tus hermanos, que estuvieron al frente del Bienestar, también tienen por ahí algunas denuncias derivadas de que a muchos adultos mayores no se les entregó su tarjeta (…) al igual que varias personas con discapacidad que hoy no tienen el recurso”. El Legislador afirmó que los señalamientos de nepotismo en su contra responden al descontento de su adversario por no haber obtenido una posición en la planilla. “Tu enojo viene porque querías la posición de la primera regiduría en la planilla del doctor. Él me lo platicó. No te la dieron y por eso hiciste berrinche y por eso hoy nos estás atacando”, concluyó.",https://www.alcalorpolitico.com/informacion/me-ataca-un-presunto-corrupto-que-hace-berrinche-paul-martinez-423858.html,"Xalapa, Ver",21/04/2025
CEDH emitirá recomendación a Fiscalía por caso “Caballo Blanco”,"Coatzacoalcos, Ver. 21/04/2025","La Comisión Estatal de Derechos Humanos (CEDH) emitirá una recomendación a la Fiscalía General del Estado (FGE) en torno al caso del bar “Caballo Blanco”, en el que 33 personas murieron durante un ataque en agosto de 2019.La recomendación se hará debido a la forma en que se entregaron los cuerpos de las víctimas, pues no se respetaron los derechos humanos ni la dignidad de las personas. “Lo que la Comisión estuvo o está integrando es la forma en la que se hizo la entrega de los cuerpos a todos los familiares, que no fueron entregas de carácter adecuado, respetando derechos y dignidad. Esa fue la investigación que se hizo con base en la queja que pusieron un gran número de familiares de las víctimas que fallecieron, desgraciadamente”, afirmó Tonatiuh Hernández, titular de la CEDH en Coatzacoalcos. Recordó que en aquel momento la FGE no contaba con instalaciones adecuadas y mucho menos estaban preparados para atender un caso así. De ahí que muchas familias se quejaron, y en breve la recomendación será emitida tras una investigación realizada por la Comisión. “Lo que pasa es que no estaban las instalaciones adecuadas, no estaban preparados, fue un evento que verdaderamente causó una desgracia. Entonces, no pudieron realizar, digamos, el resguardo de los cuerpos ni el cuidado de los mismos de la forma que marcan los protocolos. Fue una manera muy inhumana en la cual fueron entregados y reconocidos. Cada vez que uno de los familiares tenía que ir a identificar, pues la forma en que estaban dispuestos, cómo estaban acomodados, cómo estaban, digamos, guardados, no era la adecuada”, afirmó. Hernández Sarmiento dio a conocer que, por tal motivo, hace unos días se tuvo una reunión con las familias de las víctimas, donde se les informó a detalle sobre esta recomendación. “Fue una reunión única y exclusivamente para explicarles cómo va, cómo se van a manejar los términos de una recomendación que está por salir y se tomaron algunos acuerdos de brindarles apoyos fuera”, externó. Aunado a lo anterior, la CEDH también está coordinando ciertas situaciones con otras autoridades de competencia municipal y estatal para brindarles apoyos a los familiares. Estos tienen que ver con ayuda para que algunas personas se trasladen a citas médicas, a otros estados, trámites de la guarda de quienes tienen ya bajo su tutela a niños y niñas que eran hijos e hijas de personas que fallecieron, trámite en despensas y más.",https://www.alcalorpolitico.com/informacion/cedh-emitira-recomendacion-a-fiscalia-por-caso-caballo-blanco--423863.html,"Coatzacoalcos, Ver",21/04/2025
Gira de documentalesAmbulantellegará al estado de Veracruz en mayo,"Xalapa, Ver. 21/04/2025","La gira de documentales Ambulante 2025 , una de las jornadas dedicadas a este género cinematográfico más esperadas por públicos de diferentes regiones de México, llegará al estado de Veracruz en el mes de mayo con una amplia cartelera de lo mejor del cine documental contemporáneo, cuya edición celebra su 20 Aniversario de difusión cultural y artística. Iniciada formalmente el pasado 3 de abril en la Ciudad de México, la gira que en este año recorrerá otros estados como Baja California, Querétaro, Yucatán y, por supuesto, Veracruz invita a la población de la Entidad a sumarse al ""encuentro de acción colectiva para construir otros mundos posibles a través del documental"". De acuerdo con los organizadores, la programación de la edición 2025 incluye 129 títulos cinematográficos provenientes de maÌs de 40 paises, lo que resulta en filmes con 28 idiomas diferentes e incluye cine en lenguas indígena. La cartelera de Ambulante 2025 está dividida en 11 secciones: ""Pulsos"" que aborda el panorama del largometraje documental mexicano; ""Intersecciones"", donde se ofrecen funciones de cine documental contemporáneo internacional; ""Resistencias"", con enfoque en la justicia, la resiliencia y la defensa de los derechos humanos; ""Retrovisor"", punto de encuentro para archivistas provenientes de todo el país; ""Sonidero"" donde se muestran proyectos de memoria colectiva a través del sonido y la música; ""Ambulantito"", programación seleccionada especialmente para niños y niñas; ""Invocaciones"", temática enfocada a las olas y el movimiento del agua, el leitmotiv que inspira la gira de este año; ""Injerto"", una sección dedicada al cine de vanguardia; ""Coordenadas"", muestra de filmes mexicanos de cada una de las regiones incluidas en la gira 2025; Teatro documental, con enfoque central en el arte escénico como materia prima para la creación de obras mexicanas; y, finalmente, para celebrar 20 años de Ambulante, se ofrecerá un programa retrospectivo q través de 2 décadas de difusión. Ambulante Veracruz tendrá lugar del 22 al 29 de mayo por varias regiones del Estado, con la ciudad de Xalapa como una de las sedes principales. En próximas semanas se dará a conocer la programación específica y otros detalles sobre la edición 20, por lo que aconseja estar atentos a redes sociales. Agenda y asiste.",https://www.alcalorpolitico.com/informacion/gira-de-documentales-ambulante-llegara-al-estado-de-veracruz-en-mayo-423892.html,"Xalapa, Ver",21/04/2025
Exigen alto a los abusos de la CFE en la región centro de Veracruz,"Orizaba, Ver. 21/04/2025","Cansados de pagar lo que no consumen, ciudadanos organizados por el Frente Nacional de Lucha por el Socialismo (FNLS), Frente de Acción Revolucionaria (FAR) y Frente Popular Revolucionario (FPR) continúan con una protesta frente a la CFE en Orizaba, donde acusan a la empresa de cometer abusos sistemáticos en los cobros de energía eléctrica. “Esto ya no es un error administrativo, es una violación directa a nuestros derechos como usuarios”, aseguró Adriana Chávez, vocera del movimiento, quien en días pasados encabezó una protesta simbólica crucificándose como forma de visibilizar el sufrimiento que viven muchas familias por las tarifas elevadas. Teodora Reyes, una mujer de Río Blanco, es uno de tantos casos: su recibo pasó de 350 a más de mil pesos sin razón aparente. ""Ya no sabemos a quién acudir. La CFE no responde ni da explicaciones. Sólo cobra, sanciona y se va”, dijo indignada. Los manifestantes afirmaron que este tipo de quejas se han multiplicado en municipios vecinos. Además de los cobros injustos, reportan negligencia técnica, sanciones indebidas por presuntos fraudes y una total falta de atención por parte de la empresa estatal. Advirtieron que no se moverán hasta que haya una solución real. “No vamos a permitir que sigan sangrando a la gente. Esto va más allá de lo económico. Se trata de dignidad”, concluyó Chávez.",https://www.alcalorpolitico.com/informacion/exigen-alto-a-los-abusos-de-la-cfe-en-la-region-centro-de-veracruz-423893.html,"Orizaba, Ver",21/04/2025
